<?xml version="1.0" encoding="UTF-8"?>
<!--XML file generated by from VME64xTable_1.txt-->
<CARD_TYPE xmlns:xsi="http://www.w3.org/2001/XMLSchema-instance" xsi:noNamespaceSchemaLocation="HardwareAddressTable-ver-2-1.xsd" _type="Module" TYPE_ID="vme64x-2">
<!--  ******************************************************************************************************  --> 
<!--  *                   VME64x Address Table : for test purpose  --> 
<!--  *                         item       AdrSpace  map AM  width   address      mask  r  w fl  description  --> 
<!--  ******************************************************************************************************  --> 
	<VME64X_ADDRESS _type="Module" ITEM_NAME="vme64x-map1-confItem1">
		<ADDRESS _type="number">0x00000103</ADDRESS>
		<SPACE _type="string">configuration</SPACE>
		<MAP _type="number">0</MAP>
		<READ_OR_WRITE _type="string">r</READ_OR_WRITE>
		<MASK _type="number">0x000000ff</MASK>
		<DESCRIPTION _type="string">a comment</DESCRIPTION>
	</VME64X_ADDRESS>
	<VME64X_ADDRESS _type="Module" ITEM_NAME="vme64x-map1-confItem2">
		<ADDRESS _type="number">0x00000107</ADDRESS>
		<SPACE _type="string">configuration</SPACE>
		<MAP _type="number">0</MAP>
		<READ_OR_WRITE _type="string">r</READ_OR_WRITE>
		<MASK _type="number">0x000000ff</MASK>
		<DESCRIPTION _type="string">a somewhat longer comment</DESCRIPTION>
	</VME64X_ADDRESS>
	<VME64X_ADDRESS _type="Module" ITEM_NAME="vme64x-map1-confItem3">
		<ADDRESS _type="number">0x0000010b</ADDRESS>
		<SPACE _type="string">configuration</SPACE>
		<MAP _type="number">0</MAP>
		<READ_OR_WRITE _type="string">r</READ_OR_WRITE>
		<MASK _type="number">0x000000ff</MASK>
	</VME64X_ADDRESS>
	<VME64X_ADDRESS _type="Module" ITEM_NAME="vme64x-map1-confItem4">
		<ADDRESS _type="number">0x00000800</ADDRESS>
		<SPACE _type="string">configuration</SPACE>
		<MAP _type="number">0</MAP>
		<READ_OR_WRITE _type="string">r</READ_OR_WRITE>
		<MASK _type="number">0x000000ff</MASK>
	</VME64X_ADDRESS>
	<VME64X_ADDRESS _type="Module" ITEM_NAME="vme64x-map1-confItem5">
		<ADDRESS _type="number">0x00000810</ADDRESS>
		<SPACE _type="string">configuration</SPACE>
		<MAP _type="number">0</MAP>
		<READ_OR_WRITE _type="string">r</READ_OR_WRITE>
		<MASK _type="number">0x000000ff</MASK>
	</VME64X_ADDRESS>
	<VME64X_ADDRESS _type="Module" ITEM_NAME="vme64x-map1-confItem6">
		<ADDRESS _type="number">0x00000820</ADDRESS>
		<SPACE _type="string">configuration</SPACE>
		<MAP _type="number">0</MAP>
		<READ_OR_WRITE _type="string">r</READ_OR_WRITE>
		<MASK _type="number">0x000000ff</MASK>
	</VME64X_ADDRESS>
	<VME64X_ADDRESS _type="Module" ITEM_NAME="vme64x-map1-confItem7">
		<ADDRESS _type="number">0x0007fffb</ADDRESS>
		<SPACE _type="string">configuration</SPACE>
		<MAP _type="number">0</MAP>
		<READ_OR_WRITE _type="string">rw</READ_OR_WRITE>
		<MASK _type="number">0x000000ff</MASK>
	</VME64X_ADDRESS>
	<VME64X_ADDRESS _type="Module" ITEM_NAME="vme64x-map1-confItem8">
		<ADDRESS _type="number">0x0007ffff</ADDRESS>
		<SPACE _type="string">configuration</SPACE>
		<MAP _type="number">0</MAP>
		<READ_OR_WRITE _type="string">r</READ_OR_WRITE>
		<MASK _type="number">0x000000ff</MASK>
	</VME64X_ADDRESS>
	<VME64X_ADDRESS _type="Module" ITEM_NAME="vme64x-map1-item1">
		<ADDRESS _type="number">0x00000000</ADDRESS>
		<SPACE _type="string">memory</SPACE>
		<MAP _type="number">0</MAP>
		<READ_OR_WRITE _type="string">rw</READ_OR_WRITE>
		<MASK _type="number">0xffffffff</MASK>
	</VME64X_ADDRESS>
	<VME64X_ADDRESS _type="Module" ITEM_NAME="vme64x-map1-item2">
		<ADDRESS _type="number">0x00000010</ADDRESS>
		<SPACE _type="string">memory</SPACE>
		<MAP _type="number">0</MAP>
		<READ_OR_WRITE _type="string">rw</READ_OR_WRITE>
		<MASK _type="number">0xffffffff</MASK>
		<DESCRIPTION _type="string">next has empty</DESCRIPTION>
	</VME64X_ADDRESS>
	<VME64X_ADDRESS _type="Module" ITEM_NAME="vme64x-map1-item3">
		<ADDRESS _type="number">0x00000000</ADDRESS>
		<SPACE _type="string">memory</SPACE>
		<MAP _type="number">1</MAP>
		<READ_OR_WRITE _type="string">rw</READ_OR_WRITE>
		<MASK _type="number">0xffffffff</MASK>
	</VME64X_ADDRESS>
	<VME64X_ADDRESS _type="Module" ITEM_NAME="vme64x-map1-item4">
		<ADDRESS _type="number">0x00000010</ADDRESS>
		<SPACE _type="string">memory</SPACE>
		<MAP _type="number">1</MAP>
		<READ_OR_WRITE _type="string">rw</READ_OR_WRITE>
		<MASK _type="number">0xffffffff</MASK>
	</VME64X_ADDRESS>
	<VME64X_ADDRESS _type="Module" ITEM_NAME="vme64x-map1-item5">
		<ADDRESS _type="number">0x00000000</ADDRESS>
		<SPACE _type="string">memory</SPACE>
		<MAP _type="number">2</MAP>
		<READ_OR_WRITE _type="string">rw</READ_OR_WRITE>
		<MASK _type="number">0x00000080</MASK>
	</VME64X_ADDRESS>
</CARD_TYPE>
