<?xml version="1.0" encoding="UTF-8"?>
<!--XML file generated by from VMETable_1.txt-->
<CARD_TYPE xmlns:xsi="http://www.w3.org/2001/XMLSchema-instance" xsi:noNamespaceSchemaLocation="HardwareAddressTable-ver-2-1.xsd" _type="Module" TYPE_ID="vme-2">
<!--  ******************************************************************************************************  --> 
<!--  *                   VME64x Address Table : for test purpose  --> 
<!--  *                         item       AdrSpace  map AM  width   address      mask  r  w fl  description  --> 
<!--  ******************************************************************************************************  --> 
	<VME_ADDRESS _type="Module" ITEM_NAME="vme-map1-item1">
		<ADDRESS _type="number">0x00000000</ADDRESS>
		<ADDRESS_MODIFIER _type="number">0x39</ADDRESS_MODIFIER>
		<READ_OR_WRITE _type="string">rw</READ_OR_WRITE>
		<WIDTH _type="number">4</WIDTH>
		<MASK _type="number">0xffffffff</MASK>
		<DESCRIPTION _type="string">This is the first item</DESCRIPTION>
	</VME_ADDRESS>
	<VME_ADDRESS _type="Module" ITEM_NAME="vme-map1-item2">
		<ADDRESS _type="number">0x00000010</ADDRESS>
		<ADDRESS_MODIFIER _type="number">0x09</ADDRESS_MODIFIER>
		<READ_OR_WRITE _type="string">rw</READ_OR_WRITE>
		<WIDTH _type="number">4</WIDTH>
		<MASK _type="number">0xffffffff</MASK>
		<DESCRIPTION _type="string">This is a comment</DESCRIPTION>
	</VME_ADDRESS>
	<VME_ADDRESS _type="Module" ITEM_NAME="vme-map1-item3">
		<ADDRESS _type="number">0x00000000</ADDRESS>
		<ADDRESS_MODIFIER _type="number">0x10</ADDRESS_MODIFIER>
		<READ_OR_WRITE _type="string">rw</READ_OR_WRITE>
		<WIDTH _type="number">4</WIDTH>
		<MASK _type="number">0xffffffff</MASK>
		<DESCRIPTION _type="string">no comment</DESCRIPTION>
	</VME_ADDRESS>
	<VME_ADDRESS _type="Module" ITEM_NAME="vme-map1-item4">
		<ADDRESS _type="number">0x00000010</ADDRESS>
		<ADDRESS_MODIFIER _type="number">0x19</ADDRESS_MODIFIER>
		<READ_OR_WRITE _type="string">rw</READ_OR_WRITE>
		<WIDTH _type="number">4</WIDTH>
		<MASK _type="number">0xffffffff</MASK>
	</VME_ADDRESS>
	<VME_ADDRESS _type="Module" ITEM_NAME="vme-map1-item5">
		<ADDRESS _type="number">0x00000000</ADDRESS>
		<ADDRESS_MODIFIER _type="number">0x39</ADDRESS_MODIFIER>
		<READ_OR_WRITE _type="string">rw</READ_OR_WRITE>
		<WIDTH _type="number">4</WIDTH>
		<MASK _type="number">0x00000080</MASK>
	</VME_ADDRESS>
</CARD_TYPE>
